{"id":"lookup","mediaType":"application/vnd.agentsuite.tool.provider.v1+json","protocol":"mcp","revision":"2025-06-18","schemaVersion":"1.0.0-draft","tools":[{"description":"Look up a source identifier.","effect":"read-only","inputSchema":{"descriptor":{"digest":"sha256:9c2fe9762111c1e93a19017a10e9403fb537083419ba45c46312aafe8b95aaab","mediaType":"application/schema+json","size":122},"path":"schemas/lookup-input.json"},"name":"lookup"}],"variants":[{"entrypoint":"/opt/agentsuite/tool-providers/lookup/bin/lookup","files":[{"component":"lookup","digest":"sha256:9e24b8ca3385c586ecc9b467ee6f9f8f23539fc0db584dd5949fe1c0c445193b","gid":0,"mode":493,"path":"bin/lookup","size":45,"type":"file","uid":0}],"installRoot":"/opt/agentsuite/tool-providers/lookup","payloadRoot":"tool-providers/lookup/1.0.0/linux-amd64","platform":{"architecture":"amd64","os":"linux"},"runtime":{"abi":"static","cpuBaseline":"x86-64-v1"},"variantDigest":"sha256:8fa188685a9216bf2accee8025a50c88e2027e677f41c156dc87d8877fc507a6"}],"version":"1.0.0"}